{
  "schema": 1,
  "serverTime": "2026-09-28T12:00:00Z",
  "scope": "AT",
  "layers": {
    "warnings": {
      "scope": "AT",
      "status": "partial",
      "version": "3f9a1c2e",
      "url": "data/v1/AT/warnings.3f9a1c2e.json",
      "checkedAt": "2026-09-28T11:59:00Z",
      "generatedAt": "2026-09-28T11:58:00Z",
      "sourceUpdatedAt": "2026-09-28T11:55:00Z",
      "itemCount": 3,
      "issues": [{ "key": "issue.missingDetailText", "params": { "count": 1 } }],
      "stale": false,
      "intervalSec": 120,
      "lastError": null
    },
    "weather": {
      "scope": "AT",
      "status": "ok",
      "version": "aa000001",
      "url": "data/v1/AT/weather.aa000001.json",
      "checkedAt": "2026-09-28T11:55:00Z",
      "generatedAt": "2026-09-28T11:45:00Z",
      "sourceUpdatedAt": "2026-09-28T11:45:00Z",
      "itemCount": 2,
      "issues": [],
      "stale": false,
      "intervalSec": 300,
      "lastError": null
    },
    "air": {
      "scope": "AT",
      "status": "ok",
      "version": "aa000002",
      "url": "data/v1/AT/air.aa000002.json",
      "checkedAt": "2026-09-28T11:55:00Z",
      "generatedAt": "2026-09-28T11:45:00Z",
      "sourceUpdatedAt": "2026-09-28T11:00:00Z",
      "itemCount": 1,
      "issues": [],
      "stale": false,
      "intervalSec": 300,
      "lastError": null
    },
    "water": {
      "scope": "AT",
      "status": "pending",
      "version": null,
      "url": null,
      "checkedAt": null,
      "generatedAt": null,
      "sourceUpdatedAt": null,
      "itemCount": 0,
      "issues": [],
      "stale": false,
      "intervalSec": 300,
      "lastError": null
    },
    "radiation": {
      "scope": "AT",
      "status": "ok",
      "version": "aa000003",
      "url": "data/v1/AT/radiation.aa000003.json",
      "checkedAt": "2026-09-28T11:50:00Z",
      "generatedAt": "2026-09-28T11:30:00Z",
      "sourceUpdatedAt": "2026-09-28T11:00:00Z",
      "itemCount": 2,
      "issues": [],
      "stale": false,
      "intervalSec": 600,
      "lastError": { "at": "2026-09-28T11:58:00Z", "message": { "key": "error.allSourcesFailed" } }
    },
    "space": {
      "scope": "global",
      "status": "ok",
      "version": "aa000004",
      "url": "data/v1/global/space.aa000004.json",
      "checkedAt": "2026-09-28T11:55:00Z",
      "generatedAt": "2026-09-28T11:40:00Z",
      "sourceUpdatedAt": "2026-09-28T09:00:00Z",
      "itemCount": 3,
      "issues": [],
      "stale": false,
      "intervalSec": 300,
      "lastError": null
    },
    "nature": {
      "scope": "AT",
      "status": "ok",
      "version": "aa000005",
      "url": "data/v1/AT/nature.aa000005.json",
      "checkedAt": "2026-09-28T11:55:00Z",
      "generatedAt": "2026-09-28T11:40:00Z",
      "sourceUpdatedAt": "2026-09-28T11:39:00Z",
      "itemCount": 1,
      "issues": [],
      "stale": false,
      "intervalSec": 300,
      "lastError": null
    },
    "traffic": {
      "scope": "AT",
      "status": "ok",
      "version": "aa000006",
      "url": "data/v1/AT/traffic.aa000006.json",
      "checkedAt": "2026-09-28T11:58:00Z",
      "generatedAt": "2026-09-28T11:56:00Z",
      "sourceUpdatedAt": "2026-09-28T11:55:00Z",
      "itemCount": 1,
      "issues": [],
      "stale": true,
      "intervalSec": 120,
      "lastError": null
    },
    "news": {
      "scope": "global",
      "status": "partial",
      "version": "aa000007",
      "url": "data/v1/global/news.aa000007.json",
      "checkedAt": "2026-09-28T11:59:00Z",
      "generatedAt": "2026-09-28T11:58:00Z",
      "sourceUpdatedAt": "2026-09-28T11:50:00Z",
      "itemCount": 3,
      "issues": [{ "key": "issue.sourceFailed", "params": { "source": "SRF News" } }],
      "stale": false,
      "intervalSec": 120,
      "lastError": null
    }
  }
}
